{
  "accountProfilesRetained": true,
  "backupId": "20260717T120000Z",
  "cloudxEntrypointsUnchanged": true,
  "endpointScope": "current_user_home",
  "externalLocalCpaUnchanged": true,
  "freshShellAccepted": true,
  "legacyLauncherLive": false,
  "legacyRuntimeLive": false,
  "localCpaConfigurationRetained": true,
  "localCpaLaunchAgentRetained": true,
  "nativeImportDryRunAccepted": true,
  "officialCodexPreserved": true,
  "officialGitPreserved": true,
  "privateRecoveryBundleRetained": true,
  "processTerminated": false,
  "quarantineRetained": true,
  "recoveryEntrypointLive": false,
  "releaseVersion": "0.1.15",
  "schema": "cloudx.legacy-local-removal.v1",
  "serviceRestarted": false,
  "shellHookUnchanged": true,
  "status": "quarantined",
  "targetsQuarantined": 3
}
